<?xml version="1.0" encoding="UTF-8"?><cf:workflow xsi:schemaLocation="http://lkh.com/cflow ../schemas/wft.xsd" name="tobedelete" owner="LKH" acl="private" lastModified="2011-03-19T04:18:58" created="2011-03-19T04:18:58" xmlns:cf="http://lkh.com/cflow" xmlns:xsi="http://www.w3.org/2001/XMLSchema-instance"><node id="id_start" type="start" title="Start" name="Start" x="27" y="213">
 <next targetID="id_1"/></node><node id="id_end" type="end" title="End" name="End" x="738" y="213">
 <next targetID="id_end"/></node><node id="id_1" type="task" title="mpsm_2" name="Task" x="356" y="203" acquirable="false" acqThreshold="1" allowRoleChange="false" allowDelegate="false" allowAdhoc="false" roleToChange="all" form="" mpsm="3">
 <taskto type="role" whom="Approver"/>
 <mpcdc>if(finished>=2) return "true"; else return "false";</mpcdc>
 <oec>if(finished>=2) return "4"; else return "DEFAULT";</oec>
 <next option="4" targetID="id_4"/>
 <next option="DEFAULT" targetID="id_end"/>
 </node><node id="id_4" type="task" title="totalequalsto4" name="Task" x="356" y="203" acquirable="false" acqThreshold="1" allowRoleChange="false" allowDelegate="false" allowAdhoc="false" roleToChange="all" form="" mpsm="1">
 <taskto type="role" whom="starter"/>
 <mpcdc/>
 <oec/>
 <next targetID="id_end"/>
  </node></cf:workflow>