<?xml version="1.0" encoding="UTF-8"?><cf:workflow xsi:schemaLocation="http://lkh.com/cflow ../schemas/wft.xsd" name="Demo_RoleReference" memo="Demonstrate how to determine a task's undertaker with reference. The task of 'Check' will be done by Reviewer, but this task will not be dispatched to poeple who also take the role as Reviewer and did the fist task, say 'Review'; The task of 'Result' will be dispatched to who did the 'Review' task by role referencing machanism. " owner="tester1" acl="private" lastModified="2012-11-10T23:24:00" created="2012-11-10T23:24:00" xmlns:cf="http://lkh.com/cflow" xmlns:xsi="http://www.w3.org/2001/XMLSchema-instance">
  <role name="Reviwer"/>
  <role name="Reviewer"/>
  <node id="C18F90B7-8FA9-AD83-C0D8-EAD6804B3F48" type="start" title="Start" name="Start" x="28" y="228">
    <next targetID="BBD4A418-66CE-E2CA-0E37-EAD7FA87E900"/>
  </node>
  <node id="8EADD8E5-2A9F-8801-641B-EAD6804FEA64" type="end" title="End" name="End" x="433" y="223">
    <next targetID="8EADD8E5-2A9F-8801-641B-EAD6804FEA64"/>
  </node>
  <node id="BBD4A418-66CE-E2CA-0E37-EAD7FA87E900" type="task" title="Please reveiw the doc[br]This demo template show role referece and mutual exclusion. [br]To try it, you must start this workflow with a team contains a role of &quot;Reviewer&quot; which maps to at least two different people.  The first two tasks should be done by Reviewer, but the people who did the first one will not see the second task in his/her worklist, and the third task will be delivered to people who did the first task." name="Review" x="104" y="225" acquirable="false" acqThreshold="1" allowRoleChange="false" allowDelegate="false" allowAdhoc="false" roleToChange="all" form="" mpsm="1">
    <taskto type="role" whom="Reviwer"/>
    <mpcdc>null</mpcdc>
    <oec>null</oec>
    <attachment type="text" label="Reviewer_Comment" attname="reviewer_comment" value="Please input your comment"/>
    <next targetID="579A2CF4-ECB2-A8AB-84D1-EAD8625C11DD"/>
  </node>
  <node id="579A2CF4-ECB2-A8AB-84D1-EAD8625C11DD" type="task" title="Please chek the review" name="Check" x="190" y="225" acquirable="false" acqThreshold="1" allowRoleChange="false" allowDelegate="false" allowAdhoc="false" roleToChange="all" form="" mpsm="1">
    <taskto type="role" whom="Reviewer">
      <exceptme nodeid="BBD4A418-66CE-E2CA-0E37-EAD7FA87E900"/>
    </taskto>
    <mpcdc>null</mpcdc>
    <oec>null</oec>
    <attachment type="text" label="Checker Comment" attname="checker_comment" value=""/>
    <next targetID="AA8CC982-16D2-FD39-A448-EAE52A49CD1B"/>
  </node>
  <node id="AA8CC982-16D2-FD39-A448-EAE52A49CD1B" type="task" title="Task" name="Result" x="312" y="222" acquirable="false" acqThreshold="1" allowRoleChange="false" allowDelegate="false" allowAdhoc="false" roleToChange="all" form="" mpsm="1">
    <taskto type="RefertoNode" whom="BBD4A418-66CE-E2CA-0E37-EAD7FA87E900"/>
    <mpcdc>null</mpcdc>
    <oec>null</oec>
    <next targetID="8EADD8E5-2A9F-8801-641B-EAD6804FEA64"/>
  </node>
</cf:workflow>
