<cf:workflow xsi:schemaLocation="http://lkh.com/cflow ../schemas/wft.xsd" name="Leave Application" owner="aliyun" acl="private" lastModified="2012-11-30T07:21:44" created="2012-11-30T07:21:44" xmlns:cf="http://lkh.com/cflow" xmlns:xsi="http://www.w3.org/2001/XMLSchema-instance">
  <role name="Approver"/>
  <node id="5CC4CFA1-6533-45D5-94AD-59F4A2A296DC" type="start" title="Start" name="Start" x="26" y="92">
    <next targetID="F3518383-8E11-E6D2-A536-59F4CA5D114B" joints=""/>
  </node>
  <node id="022434F3-87E5-21E2-4105-59F4A2A9FD68" type="end" title="End" name="End" x="750" y="231">
    <next targetID="022434F3-87E5-21E2-4105-59F4A2A9FD68"/>
  </node>
  <node id="F3518383-8E11-E6D2-A536-59F4CA5D114B" type="task" title="Please input leave days and reason." name="Leave Application" x="150" y="93" acquirable="false" acqThreshold="1" allowRoleChange="false" allowDelegate="false" allowAdhoc="false" roleToChange="all" form="null" mpsm="1">
    <taskto type="role" whom="starter"/>
    <mpcdc>null</mpcdc>
    <oec>null</oec>
    <attachment type="int" label="Leave Days" attname="days" value=""/>
    <attachment type="text" label="Leave Reason" attname="reason" value=""/>
    <next targetID="A1878F04-2D3D-3D88-E3DA-59F5FBB94E2F" joints=""/>
  </node>
  <node id="A1878F04-2D3D-3D88-E3DA-59F5FBB94E2F" type="task" title="Please decide whether to approve leave or not" name="Leave waiting for your approval" x="110" y="226" acquirable="false" acqThreshold="1" allowRoleChange="false" allowDelegate="false" allowAdhoc="false" roleToChange="all" form="null" mpsm="1">
    <taskto type="role" whom="Approver"/>
    <mpcdc>null</mpcdc>
    <oec>null</oec>
    <attachment type="text" label="Your Comment" attname="approveComment" value=""/>
    <next option="1.Approve it." targetID="7CE979C9-5530-79C0-768F-59F637566ECF" joints=""/>
    <next option="2.Reject it." targetID="348CAF86-53E0-A373-6F51-59F657CCCF0E" joints=""/>
  </node>
  <node id="7CE979C9-5530-79C0-768F-59F637566ECF" type="task" title="Congratulation, your leave application has been approved." name="Your Leave was approved." x="461" y="231" acquirable="false" acqThreshold="1" allowRoleChange="false" allowDelegate="false" allowAdhoc="false" roleToChange="all" form="null" mpsm="1">
    <taskto type="role" whom="starter"/>
    <mpcdc>null</mpcdc>
    <oec>null</oec>
    <next targetID="022434F3-87E5-21E2-4105-59F4A2A9FD68" joints=""/>
  </node>
  <node id="348CAF86-53E0-A373-6F51-59F657CCCF0E" type="task" title="Your leave has been rejected.&#xD;[p]Do you want to apply again?[/p]" name="Leave was rejected" x="486" y="90" acquirable="false" acqThreshold="1" allowRoleChange="false" allowDelegate="false" allowAdhoc="false" roleToChange="all" form="null" mpsm="1">
    <taskto type="role" whom="starter"/>
    <mpcdc>null</mpcdc>
    <oec>null</oec>
    <next option="2.Give up" targetID="022434F3-87E5-21E2-4105-59F4A2A9FD68" joints=""/>
    <next option="1.Re-apply" targetID="F3518383-8E11-E6D2-A536-59F4CA5D114B" joints="362:54"/>
  </node>
</cf:workflow>