<?xml version="1.0" encoding="UTF-8"?><cf:workflow xsi:schemaLocation="http://lkh.com/cflow ../schemas/wft.xsd" name="tobedelete" owner="LKH" acl="private" lastModified="2011-03-19T04:18:58" created="2011-03-19T04:18:58" xmlns:cf="http://lkh.com/cflow" xmlns:xsi="http://www.w3.org/2001/XMLSchema-instance"><node id="id_start" type="start" title="Start" name="Start" x="27" y="213">
 <next targetID="id_1"/><next targetID="id_2"/><next targetID="id_3"/></node><node id="id_end" type="end" title="End" name="End" x="738" y="213">
 <next targetID="id_end"/></node><node id="id_1" type="task" title="ID_1" name="ID_1"  acquirable="false" acqThreshold="1" allowRoleChange="false" allowDelegate="false" allowAdhoc="false" roleToChange="all" form="" mpsm="1">
 <taskto type="role" whom="starter"/>
 <mpcdc/>
 <oec/>
 <next targetID="id_AND"/></node><node id="id_2" type="task" title="ID_2" name="ID_2"  acquirable="false" acqThreshold="1" allowRoleChange="false" allowDelegate="false" allowAdhoc="false" roleToChange="all" form="" mpsm="1">
 <taskto type="role" whom="starter"/>
 <mpcdc/>
 <oec/>
 <next targetID="id_AND"/></node><node id="id_3" type="task" title="ID_3" name="ID_3"  acquirable="false" acqThreshold="1" allowRoleChange="false" allowDelegate="false" allowAdhoc="false" roleToChange="all" form="" mpsm="1">
 <taskto type="role" whom="starter"/>
 <mpcdc/>
 <oec/>
 <next targetID="id_AND"/></node><node id='id_AND' type='and'><next targetID='id_NULL'/></node><node id="id_NULL" type="task" title="ID_NULL" name="ID_NULL"  acquirable="false" acqThreshold="1" allowRoleChange="false" allowDelegate="false" allowAdhoc="false" roleToChange="all" form="" mpsm="1">
 <taskto type="role" whom="starter"/>
 <mpcdc/>
 <oec/>
 <next targetID="id_end"/></node></cf:workflow>